{
  "schema_version": "0.1",
  "lease_token": "lease_v1_2f8c41ab93d5e7f60a1b",
  "sequence": 0,
  "idempotency_key": "7f4b2a68-a239-43b7-9456-8b2c4d70afd6",
  "output": {
    "type": "agent_message",
    "content": "Moved IdeasArchive.txt to documents/Archived/."
  },
  "observations": [],
  "operational": {
    "duration_ms": 1200,
    "retry_count": 0,
    "runner_version": "0.1.0"
  }
}
